{
   "wsagger": "0.0.3",
   "info": {
      "description": "GBKSOFT chat API",
      "version": "1.0.0",
      "title": "GBKSOFT chat API"
   },

   "server_" : {
      "loc":  { "proto": "socket.io", "host": "127.0.0.1",                    "port": "28780", "path": "/front_space" },
      "dev":  { "proto": "socket.io", "host": "chat-nodejs.dev.gbksoft.net",  "port": "28781", "path": "/front_space" },
      "test": { "proto": "socket.io", "host": "chat-nodejs.test.gbksoft.net", "port": "28782", "path": "/front_space" },
      "live": { "proto": "socket.io", "host": "chat-nodejs.live.gbksoft.net", "port": "28783", "path": "/front_space" }
   },

   "user_" : {
       "2":  { "token": "2" },
       "3":  { "token": "3" },
       "4":  { "token": "4" }
   },


   "scenarios": [
      {
         "name": "send and receive message in common group",
         "parameters": [
            { "in": "!!!!!!!!", "name": "messageText", "description": "", "dataType": "string" }
         ],
         "flow": [
            { "worker": "2",  "action": "connect", "data": [{"token": "4"}], 
              "waitForResponse": { "delay": 3000, "data": [["connected", {}], ["messageGroup", {"messageText" : "{{messageText}}"}]] }},

            { "action": "connect", "data": [{"token": "{{token}}"}], 
              "waitForResponse": { "delay": 3000, "data": [["connected", {}]] }},             
            { "action": "request", "data": ["sendMessage", {"type": "group", "groupId": "0", "messageText": "{{messageText}}"}], 
              "waitForResponse": { "delay": 3000, "data": [["message", {}]] }}
          ]
      }
   ]
}
