{
   "wsagger": "0.0.3",
   "info": {
      "description": "GBKSOFT chat API",
      "version": "1.0.0",
      "title": "GBKSOFT chat API"
   },

   "server_" : {
      "localhost":                   { "proto": "socket.io", "host": "127.0.0.1",                   "port": "28780", "path": "/front_space" },
      "chat-nodejs.dev.gbksoft.net": { "proto": "socket.io", "host": "chat-nodejs.dev.gbksoft.net", "port": "28781", "path": "/front_space" }
   },

   "user_" : {
       "token2":     { "token": "2"                                   },
       "tokenapi25": { "token": "api25"                               },
       "pavlo":      { "username": "pavlo",    "password": "pavlo"    },
       "alexr":      { "username": "alexr",    "password": "alexr"    },
       "roman":      { "username": "roman",    "password": "roman"    },
       "olexandr":   { "username": "olexandr", "password": "olexandr" }
   },

   "scenarios": [
       {
          "name": "send and receive message in common group",
          "parameters": [
             { "in": "slave",    "name": "tokenSlave",  "description": "", "dataType": "string" },
             { "in": "!!!!!!!!", "name": "messageText", "description": "", "dataType": "string" }
          ],
          "operationId": "connect",
          "flow": [
             { "worker": "slave",  "action": "connect", "data": [{"token": "{{tokenSlave}}"}], 
               "waitForResponse": { "delay": 3000, "data": [["connected", {}]] }},
             { "worker": "slave",  
               "waitForResponse": { "delay": 3000, "data": [["message", {"messageText" : "{{messageText}}"}]] }},

             { "action": "connect", "data": [{"token": "{{token}}"}], 
               "waitForResponse": { "delay": 3000, "data": [["connected", {}]] }},             

             { "action": "request", "data": ["sendMessage", {"type": "group", "groupId": "1", "messageText": "{{messageText}}"}], 
               "waitForResponse": { "delay": 3000, "data": [["message", {}]] }}
          ]
       }
    ]
}
