{
  "wsagger": "0.0.3",
  "info": {
      "description": "GBKSOFT chat API",
      "version": "1.0.0",
      "title": "GBKSOFT chat API"
  },

  "server_" : {
      "dev":  { "proto": "socket.io", "host": "gambling-game-node.dev.gbksoft.net", "port": "28790", "path": "/front_space" },
      "loc":  { "proto": "socket.io", "host": "127.0.0.1",                          "port": "28780", "path": "/front_space" }
  },

  "scenarios": [
    {
      "name": "connect to socket.io without token",
      "parameters": [
      ],
          
      "flow": [
        { 
          "action": "socket_io.connect", 
            
          "wait": {"delay": 3000}, 

          "expected": [[ "CID", {}]],

          "data": { 

            "url": "http://{{server.host}}:{{server.port}}{{server.path}}",
            
            "query": {}

          }         
        }  
      ]
    }
  ]  
}

