{
   "wsagger": "0.0.3",
   "info": {
      "description": "GBKSOFT chat API",
      "version": "1.0.0",
      "title": "GBKSOFT chat API"
   },

   "server_" : {
      "dev": { "proto": "socket.io", "host": "gambling-game-node.dev.gbksoft.net", "port": "28790", "path": "/front_space" },
      "loc": { "proto": "socket.io", "host": "127.0.0.1",                          "port": "28780", "path": "/front_space" }
   },

   "user_" : {
       "4loc":  { "token": "T4_h92ldg6w5GiwAAAA1d420d6fec64fdbd6e707413570850341f64c1d8a0f4f45a279c32ce69fcc3ec64_3YLAfq6S14xjAR4I3dzbaFSHmfvtVp_XR_RJMt83DkPKQ2mQvYGFld2_grqtb5" }




   },

   "scenarios": [
       {
          "name": "connect to socket.io with token",
          "summary": " ",
          "parameters": [
             { "in": "formData", "name": "token", "description": "", "dataType": "string" }
          ],
          "flow": [
             { "action": "connect", "data": [{"token": "{{token}}"}],
               "wait": { "delay": 3000, "expected": [["connectedTo", {"APIVersion": "Gambling.1.0.0"}]] }
             },
             
             { 
               "action": "request", "data": ["getUsersOnline", {"type": "facebook"}], 
               "wait": { "delay": 3000, "expected": [["usersOnline",  {"type": "facebook", "userIds": []}]] }
             }
                          
             
          ]
       }
    ]
}


