{
   "wsagger": "0.0.3",
   "info": {
      "description": "GBKSOFT chat API",
      "version": "1.0.0",
      "title": "GBKSOFT chat API"
   },

   "server_" : {
      "loc": { "proto": "socket.io", "host": "127.0.0.1",                          "port": "28780", "path": "/front_space" },
      "dev": { "proto": "socket.io", "host": "gambling-game-node.dev.gbksoft.net", "port": "28790", "path": "/front_space" }
   },

   "user_" : {
       "2":  { "token": "2" },
       "3":  { "token": "3" }
   },

   "scenarios": [
       {
          "name": "connect to socket.io with token",
          "summary": " ",
          "parameters": [
             { "in": "formData", "name": "token", "description": "", "dataType": "string", "default_in": "/front_space#Hgzj1AMHqR5qgB6fAAAD|48fcb6be303bfe74c98a3116f158826aa4ec8936c5013c7b05a8ec5f8f55b0735_BS-x101q7VaFzLq95EijBqcWHRTdJfTdz0pM_GK5dC3OoHnSYsDDw2tVA9fiKe" }
          ],
          "flow": [
             { "action": "connect", "data": [{"token": "{{token}}"}],
               "waitForResponse": {
                  "delay": 3000, 
                  "data": [
                     ["connectedTo", {"APIVersion": "Gambling.1.0.0"}]
                  ]
               }
             }
          ]
       }
    ]
}

